{
  "id": "troll_cave",
  "name": "Troll Cave",
  "description": "A dark cave inhabited by powerful trolls.",
  "tier": 2,
  "requiredLevel": 11,
  "requiredDungeonId": "haunted_forest",
  "monsterPools": [
    {
      "monsterId": "troll",
      "weight": 60,
      "minLevel": 11,
      "maxLevel": 14
    },
    {
      "monsterId": "orc_warrior",
      "weight": 30,
      "minLevel": 12,
      "maxLevel": 15
    },
    {
      "monsterId": "ogre",
      "weight": 10,
      "minLevel": 13,
      "maxLevel": 16
    }
  ],
  "rewards": {
    "experienceBonus": 1.35,
    "goldBonus": 1.3,
    "itemDropRate": 1.15
  }
}

