{
  "id": "forest_clearing",
  "name": "Forest Clearing",
  "description": "A peaceful clearing where weak monsters gather.",
  "tier": 1,
  "requiredLevel": 1,
  "monsterPools": [
    {
      "monsterId": "goblin",
      "weight": 50,
      "minLevel": 1,
      "maxLevel": 3
    },
    {
      "monsterId": "wolf",
      "weight": 30,
      "minLevel": 1,
      "maxLevel": 4
    },
    {
      "monsterId": "skeleton",
      "weight": 20,
      "minLevel": 2,
      "maxLevel": 4
    }
  ],
  "rewards": {
    "experienceBonus": 1.0,
    "goldBonus": 1.0
  }
}

